id,domain,text,label,discourse_subtype,discourse_tree_json,unsupported_nucleus,evidence_density,contrast_density,closure_strength,weak_to_strong_inference,support_balance,defeater_presence,nucleus_pressure
dcw_0758,financial reasoning,The explanation preserves the contrast between expense misclassification and income stability. The final conclusion follows only after weighing both.,grounded,contrast_preservation,"{""root"": ""Evidence-Based Conclusion"", ""children"": [{""role"": ""Nucleus"", ""relation"": ""Evidence""}, {""role"": ""Nucleus"", ""relation"": ""Contrast""}]}",0.103,0.601,0.273,0.077,0.235,0.464,0.822,0.31
dcw_0885,scientific explanation,The explanation preserves the contrast between measurement bias and abductive explanation. The final conclusion follows only after weighing both.,grounded,consistent_abduction,"{""root"": ""Qualified Conclusion"", ""children"": [{""role"": ""Nucleus"", ""relation"": ""Cause""}, {""role"": ""Nucleus"", ""relation"": ""Condition""}]}",0.2,0.643,0.416,0.26,0.359,0.864,0.75,0.232
dcw_0865,medical diagnosis,"witness statements provides evidence, while missing evidence acts as a defeater. The conclusion is limited rather than absolute.",grounded,qualified_conclusion,"{""root"": ""Qualified Conclusion"", ""children"": [{""role"": ""Nucleus"", ""relation"": ""Evidence""}, {""role"": ""Satellite"", ""relation"": ""Elaboration""}]}",0.257,0.628,0.742,0.022,0.23,0.848,0.714,0.273
dcw_0405,medical diagnosis,"a superficial similarity suggests a possibility, so the explanation concludes colon cancer without considering alternatives.",hallucinated,defeater_suppression,"{""root"": ""Unsupported Nucleus"", ""children"": [{""role"": ""Satellite"", ""relation"": ""Cause""}, {""role"": ""Suppressed"", ""relation"": ""Defeater""}]}",0.644,0.441,0.149,0.893,0.556,0.01,0.059,0.744
dcw_0755,financial reasoning,"The claim is supported by transaction records. However, high-risk investment remains possible, so the conclusion is qualified.",grounded,defeater_preservation,"{""root"": ""Evidence-Based Conclusion"", ""children"": [{""role"": ""Nucleus"", ""relation"": ""Evidence""}, {""role"": ""Satellite"", ""relation"": ""Defeater""}]}",0.271,0.927,0.897,0.474,0.032,0.679,0.419,0.394
dcw_0384,legal complaint,The reasoning jumps from a superficial similarity to valid small-claims escalation. No competing explanation is discussed.,hallucinated,contradiction_omission,"{""root"": ""Overstated Conclusion"", ""children"": [{""role"": ""Satellite"", ""relation"": ""Weak Evidence""}, {""role"": ""Omitted"", ""relation"": ""Contrast""}]}",0.687,0.316,0.105,0.886,0.512,0.25,0.27,0.943
dcw_0253,technical troubleshooting,a superficial similarity is mentioned. This clearly proves Nginx routing error. Therefore the conclusion is certain.,hallucinated,weak_evidence_amplification,"{""root"": ""Overstated Conclusion"", ""children"": [{""role"": ""Satellite"", ""relation"": ""Weak Evidence""}, {""role"": ""Nucleus"", ""relation"": ""Result""}]}",0.944,0.064,0.015,0.808,0.697,0.301,0.03,0.645
dcw_0867,travel planning,"prior measurements suggests permit requirement, but missing evidence weakens a stronger conclusion. Therefore, the answer should remain tentative.",grounded,consistent_abduction,"{""root"": ""Qualified Conclusion"", ""children"": [{""role"": ""Nucleus"", ""relation"": ""Cause""}, {""role"": ""Nucleus"", ""relation"": ""Condition""}]}",0.305,0.928,0.398,0.031,0.308,0.463,0.668,0.384
dcw_0635,financial reasoning,"witness statements provides evidence, while an alternative explanation acts as a defeater. The conclusion is limited rather than absolute.",grounded,qualified_conclusion,"{""root"": ""Qualified Conclusion"", ""children"": [{""role"": ""Nucleus"", ""relation"": ""Evidence""}, {""role"": ""Satellite"", ""relation"": ""Elaboration""}]}",0.231,0.814,0.885,0.177,0.329,0.574,0.421,0.163
dcw_0265,travel planning,The reasoning jumps from an unverified assumption to weather-related risk. No competing explanation is discussed.,hallucinated,unsupported_nucleus_promotion,"{""root"": ""Unsupported Nucleus"", ""children"": [{""role"": ""Satellite"", ""relation"": ""Weak Evidence""}, {""role"": ""Satellite"", ""relation"": ""Elaboration""}]}",0.649,0.185,0.05,0.812,0.884,0.343,0.179,0.625
dcw_0915,financial reasoning,The explanation preserves the contrast between expense misclassification and high-risk investment. The final conclusion follows only after weighing both.,grounded,qualified_conclusion,"{""root"": ""Qualified Conclusion"", ""children"": [{""role"": ""Nucleus"", ""relation"": ""Evidence""}, {""role"": ""Satellite"", ""relation"": ""Elaboration""}]}",0.284,0.842,0.355,0.333,0.019,0.991,0.338,0.158
dcw_0067,legal complaint,"a single ambiguous clue suggests a possibility, so the explanation concludes bank chargeback eligibility without considering alternatives.",hallucinated,defeater_suppression,"{""root"": ""Overstated Conclusion"", ""children"": [{""role"": ""Satellite"", ""relation"": ""Cause""}, {""role"": ""Suppressed"", ""relation"": ""Defeater""}]}",0.956,0.29,0.021,0.674,0.984,0.522,0.101,0.591
dcw_0944,legal complaint,"retrieved documents provides evidence, while an alternative explanation acts as a defeater. The conclusion is limited rather than absolute.",grounded,defeater_preservation,"{""root"": ""Stable Abductive Conclusion"", ""children"": [{""role"": ""Nucleus"", ""relation"": ""Evidence""}, {""role"": ""Satellite"", ""relation"": ""Defeater""}]}",0.204,0.715,0.649,0.432,0.16,0.501,0.365,0.444
dcw_0429,medical diagnosis,"colon cancer is asserted as the central conclusion, while the available evidence is only a superficial similarity.",hallucinated,weak_evidence_amplification,"{""root"": ""Premature Closure"", ""children"": [{""role"": ""Satellite"", ""relation"": ""Weak Evidence""}, {""role"": ""Nucleus"", ""relation"": ""Result""}]}",0.689,0.431,0.127,0.916,0.561,0.477,0.3,0.725
dcw_0158,legal complaint,a vague symptom is mentioned. This clearly proves valid small-claims escalation. Therefore the conclusion is certain.,hallucinated,weak_evidence_amplification,"{""root"": ""Unsupported Nucleus"", ""children"": [{""role"": ""Satellite"", ""relation"": ""Weak Evidence""}, {""role"": ""Nucleus"", ""relation"": ""Result""}]}",0.924,0.329,0.122,0.704,0.892,0.287,0.122,0.594
dcw_0510,scientific explanation,"The claim is supported by transaction records. However, experimental artifact remains possible, so the conclusion is qualified.",grounded,defeater_preservation,"{""root"": ""Qualified Conclusion"", ""children"": [{""role"": ""Nucleus"", ""relation"": ""Evidence""}, {""role"": ""Satellite"", ""relation"": ""Defeater""}]}",0.215,0.713,0.295,0.525,0.39,0.521,0.384,0.238
dcw_0447,travel planning,"permit requirement is asserted as the central conclusion, while the available evidence is only a superficial similarity.",hallucinated,premature_closure,"{""root"": ""Overstated Conclusion"", ""children"": [{""role"": ""Satellite"", ""relation"": ""Background""}, {""role"": ""Nucleus"", ""relation"": ""Result""}]}",0.841,0.038,0.164,0.586,0.901,0.165,0.344,0.858
dcw_0918,consumer dispute,"Because policy text and retrieved documents both support service non-performance, and the alternative refund entitlement is considered, the conclusion is cautiously accepted.",grounded,contrast_preservation,"{""root"": ""Stable Abductive Conclusion"", ""children"": [{""role"": ""Nucleus"", ""relation"": ""Evidence""}, {""role"": ""Nucleus"", ""relation"": ""Contrast""}]}",0.098,0.459,0.398,0.241,0.219,0.706,0.552,0.485
dcw_0781,travel planning,"transaction records suggests permit requirement, but a policy exception weakens a stronger conclusion. Therefore, the answer should remain tentative.",grounded,contrast_preservation,"{""root"": ""Qualified Conclusion"", ""children"": [{""role"": ""Nucleus"", ""relation"": ""Evidence""}, {""role"": ""Nucleus"", ""relation"": ""Contrast""}]}",0.309,0.465,0.82,0.519,0.055,0.971,0.267,0.477
dcw_0613,consumer dispute,"prior measurements suggests service non-performance, but a contradictory observation weakens a stronger conclusion. Therefore, the answer should remain tentative.",grounded,contrast_preservation,"{""root"": ""Evidence-Based Conclusion"", ""children"": [{""role"": ""Nucleus"", ""relation"": ""Evidence""}, {""role"": ""Nucleus"", ""relation"": ""Contrast""}]}",0.231,0.458,0.779,0.009,0.403,0.726,0.814,0.385
dcw_0507,legal complaint,"Because log messages and witness statements both support breach of warranty, and the alternative bank chargeback eligibility is considered, the conclusion is cautiously accepted.",grounded,defeater_preservation,"{""root"": ""Stable Abductive Conclusion"", ""children"": [{""role"": ""Nucleus"", ""relation"": ""Evidence""}, {""role"": ""Satellite"", ""relation"": ""Defeater""}]}",0.09,0.684,0.739,0.42,0.311,0.615,0.632,0.312
dcw_0473,medical diagnosis,a superficial similarity is mentioned. This clearly proves gout. Therefore the conclusion is certain.,hallucinated,weak_evidence_amplification,"{""root"": ""Overstated Conclusion"", ""children"": [{""role"": ""Satellite"", ""relation"": ""Weak Evidence""}, {""role"": ""Nucleus"", ""relation"": ""Result""}]}",0.834,0.347,0.108,0.84,0.822,0.047,0.334,0.794
dcw_0066,consumer dispute,The reasoning jumps from a superficial similarity to settlement eligibility. No competing explanation is discussed.,hallucinated,contradiction_omission,"{""root"": ""Overstated Conclusion"", ""children"": [{""role"": ""Satellite"", ""relation"": ""Weak Evidence""}, {""role"": ""Omitted"", ""relation"": ""Contrast""}]}",0.884,0.07,0.051,0.595,0.745,0.224,0.333,0.565
dcw_0080,medical diagnosis,"a weak correlation suggests a possibility, so the explanation concludes a medication side effect without considering alternatives.",hallucinated,premature_closure,"{""root"": ""Unsupported Nucleus"", ""children"": [{""role"": ""Satellite"", ""relation"": ""Background""}, {""role"": ""Nucleus"", ""relation"": ""Result""}]}",0.732,0.435,0.06,0.976,0.73,0.379,0.127,0.747
dcw_0390,legal complaint,an unverified assumption is mentioned. This clearly proves bank chargeback eligibility. Therefore the conclusion is certain.,hallucinated,weak_evidence_amplification,"{""root"": ""Premature Closure"", ""children"": [{""role"": ""Satellite"", ""relation"": ""Weak Evidence""}, {""role"": ""Nucleus"", ""relation"": ""Result""}]}",0.635,0.01,0.281,0.926,0.76,0.185,0.203,0.845
dcw_0282,travel planning,"permit requirement is asserted as the central conclusion, while the available evidence is only a superficial similarity.",hallucinated,weak_evidence_amplification,"{""root"": ""Premature Closure"", ""children"": [{""role"": ""Satellite"", ""relation"": ""Weak Evidence""}, {""role"": ""Nucleus"", ""relation"": ""Result""}]}",0.935,0.088,0.28,0.882,0.736,0.005,0.148,0.611
dcw_0540,travel planning,"log messages provides evidence, while a known confounder acts as a defeater. The conclusion is limited rather than absolute.",grounded,evidence_integration,"{""root"": ""Evidence-Based Conclusion"", ""children"": [{""role"": ""Nucleus"", ""relation"": ""Evidence""}, {""role"": ""Satellite"", ""relation"": ""Justification""}]}",0.314,0.994,0.271,0.274,0.039,0.908,0.898,0.543
dcw_0811,scientific explanation,"Because witness statements and prior measurements both support measurement bias, and the alternative experimental artifact is considered, the conclusion is cautiously accepted.",grounded,qualified_conclusion,"{""root"": ""Stable Abductive Conclusion"", ""children"": [{""role"": ""Nucleus"", ""relation"": ""Evidence""}, {""role"": ""Satellite"", ""relation"": ""Elaboration""}]}",0.173,0.65,0.852,0.129,0.243,0.492,0.701,0.177
dcw_0651,technical troubleshooting,"prior measurements suggests Nginx routing error, but a contradictory observation weakens a stronger conclusion. Therefore, the answer should remain tentative.",grounded,qualified_conclusion,"{""root"": ""Evidence-Based Conclusion"", ""children"": [{""role"": ""Nucleus"", ""relation"": ""Evidence""}, {""role"": ""Satellite"", ""relation"": ""Elaboration""}]}",0.307,0.588,0.521,0.11,0.137,0.614,0.853,0.254
dcw_0789,consumer dispute,"witness statements suggests settlement eligibility, but missing evidence weakens a stronger conclusion. Therefore, the answer should remain tentative.",grounded,evidence_integration,"{""root"": ""Evidence-Based Conclusion"", ""children"": [{""role"": ""Nucleus"", ""relation"": ""Evidence""}, {""role"": ""Satellite"", ""relation"": ""Justification""}]}",0.052,1,0.397,0.045,0.043,0.672,0.826,0.058
dcw_0606,scientific explanation,"The claim is supported by witness statements. However, measurement bias remains possible, so the conclusion is qualified.",grounded,evidence_integration,"{""root"": ""Qualified Conclusion"", ""children"": [{""role"": ""Nucleus"", ""relation"": ""Evidence""}, {""role"": ""Satellite"", ""relation"": ""Justification""}]}",0.341,0.76,0.353,0.22,0.033,0.664,0.55,0.051
dcw_0400,consumer dispute,a superficial similarity is mentioned. This clearly proves service non-performance. Therefore the conclusion is certain.,hallucinated,defeater_suppression,"{""root"": ""Premature Closure"", ""children"": [{""role"": ""Satellite"", ""relation"": ""Cause""}, {""role"": ""Suppressed"", ""relation"": ""Defeater""}]}",0.772,0.437,0.21,0.713,0.74,0.24,0.032,0.859
dcw_0745,technical troubleshooting,"transaction records suggests SSL certificate problem, but a contradictory observation weakens a stronger conclusion. Therefore, the answer should remain tentative.",grounded,evidence_integration,"{""root"": ""Stable Abductive Conclusion"", ""children"": [{""role"": ""Nucleus"", ""relation"": ""Evidence""}, {""role"": ""Satellite"", ""relation"": ""Justification""}]}",0.201,0.625,0.509,0.1,0.128,0.453,0.385,0.43
dcw_0412,legal complaint,"an unverified assumption suggests a possibility, so the explanation concludes bank chargeback eligibility without considering alternatives.",hallucinated,defeater_suppression,"{""root"": ""Overstated Conclusion"", ""children"": [{""role"": ""Satellite"", ""relation"": ""Cause""}, {""role"": ""Suppressed"", ""relation"": ""Defeater""}]}",0.895,0.267,0.265,0.91,0.972,0.196,0.082,0.978
dcw_0899,scientific explanation,"log messages provides evidence, while a contradictory observation acts as a defeater. The conclusion is limited rather than absolute.",grounded,defeater_preservation,"{""root"": ""Evidence-Based Conclusion"", ""children"": [{""role"": ""Nucleus"", ""relation"": ""Evidence""}, {""role"": ""Satellite"", ""relation"": ""Defeater""}]}",0.091,0.96,0.461,0.132,0.086,0.985,0.375,0.184
dcw_0184,technical troubleshooting,"database schema mismatch is asserted as the central conclusion, while the available evidence is only one anecdotal report.",hallucinated,contradiction_omission,"{""root"": ""Premature Closure"", ""children"": [{""role"": ""Satellite"", ""relation"": ""Weak Evidence""}, {""role"": ""Omitted"", ""relation"": ""Contrast""}]}",0.999,0.349,0.09,0.796,0.898,0.083,0.326,0.561
dcw_0366,technical troubleshooting,a single ambiguous clue is mentioned. This clearly proves OAuth token failure. Therefore the conclusion is certain.,hallucinated,premature_closure,"{""root"": ""Premature Closure"", ""children"": [{""role"": ""Satellite"", ""relation"": ""Background""}, {""role"": ""Nucleus"", ""relation"": ""Result""}]}",0.991,0.09,0.137,0.84,0.554,0.297,0.151,0.826
dcw_0094,medical diagnosis,a weak correlation is mentioned. This clearly proves a viral infection. Therefore the conclusion is certain.,hallucinated,unsupported_nucleus_promotion,"{""root"": ""Premature Closure"", ""children"": [{""role"": ""Satellite"", ""relation"": ""Weak Evidence""}, {""role"": ""Satellite"", ""relation"": ""Elaboration""}]}",0.819,0.007,0.18,0.659,0.572,0.236,0.215,0.658
dcw_0773,scientific explanation,"Because observed symptoms and observed symptoms both support measurement bias, and the alternative experimental artifact is considered, the conclusion is cautiously accepted.",grounded,qualified_conclusion,"{""root"": ""Evidence-Based Conclusion"", ""children"": [{""role"": ""Nucleus"", ""relation"": ""Evidence""}, {""role"": ""Satellite"", ""relation"": ""Elaboration""}]}",0.148,0.958,0.322,0.074,0.337,0.629,0.754,0.228
dcw_0037,technical troubleshooting,The reasoning jumps from a single ambiguous clue to OAuth token failure. No competing explanation is discussed.,hallucinated,contradiction_omission,"{""root"": ""Premature Closure"", ""children"": [{""role"": ""Satellite"", ""relation"": ""Weak Evidence""}, {""role"": ""Omitted"", ""relation"": ""Contrast""}]}",0.974,0.089,0.073,0.924,0.621,0.383,0.106,0.858
dcw_0946,medical diagnosis,"retrieved documents suggests appendicitis, but missing evidence weakens a stronger conclusion. Therefore, the answer should remain tentative.",grounded,consistent_abduction,"{""root"": ""Evidence-Based Conclusion"", ""children"": [{""role"": ""Nucleus"", ""relation"": ""Cause""}, {""role"": ""Nucleus"", ""relation"": ""Condition""}]}",0.255,0.875,0.736,0.037,0.447,0.575,0.677,0.502
dcw_0644,scientific explanation,"retrieved documents suggests abductive explanation, but a timing inconsistency weakens a stronger conclusion. Therefore, the answer should remain tentative.",grounded,evidence_integration,"{""root"": ""Qualified Conclusion"", ""children"": [{""role"": ""Nucleus"", ""relation"": ""Evidence""}, {""role"": ""Satellite"", ""relation"": ""Justification""}]}",0.04,1,0.468,0.27,0.158,0.75,0.681,0.139
dcw_0804,technical troubleshooting,The explanation preserves the contrast between SSL certificate problem and OAuth token failure. The final conclusion follows only after weighing both.,grounded,evidence_integration,"{""root"": ""Evidence-Based Conclusion"", ""children"": [{""role"": ""Nucleus"", ""relation"": ""Evidence""}, {""role"": ""Satellite"", ""relation"": ""Justification""}]}",0.298,0.837,0.84,0.119,0.081,0.797,0.464,0.161
dcw_0356,medical diagnosis,"appendicitis is asserted as the central conclusion, while the available evidence is only one anecdotal report.",hallucinated,weak_evidence_amplification,"{""root"": ""Overstated Conclusion"", ""children"": [{""role"": ""Satellite"", ""relation"": ""Weak Evidence""}, {""role"": ""Nucleus"", ""relation"": ""Result""}]}",0.691,0.024,0.12,0.9,0.734,0.282,0.164,0.88
dcw_0291,technical troubleshooting,a single ambiguous clue is mentioned. This clearly proves OAuth token failure. Therefore the conclusion is certain.,hallucinated,premature_closure,"{""root"": ""Overstated Conclusion"", ""children"": [{""role"": ""Satellite"", ""relation"": ""Background""}, {""role"": ""Nucleus"", ""relation"": ""Result""}]}",0.718,0.185,0.196,0.728,0.582,0.405,0.136,0.72
dcw_0592,consumer dispute,"prior measurements provides evidence, while a timing inconsistency acts as a defeater. The conclusion is limited rather than absolute.",grounded,contrast_preservation,"{""root"": ""Evidence-Based Conclusion"", ""children"": [{""role"": ""Nucleus"", ""relation"": ""Evidence""}, {""role"": ""Nucleus"", ""relation"": ""Contrast""}]}",0.329,0.662,0.628,0.232,0.26,0.831,0.736,0.387
dcw_0809,consumer dispute,"policy text provides evidence, while a contradictory observation acts as a defeater. The conclusion is limited rather than absolute.",grounded,defeater_preservation,"{""root"": ""Qualified Conclusion"", ""children"": [{""role"": ""Nucleus"", ""relation"": ""Evidence""}, {""role"": ""Satellite"", ""relation"": ""Defeater""}]}",0.13,0.574,0.787,0.135,0.07,0.996,0.267,0.123
dcw_0525,scientific explanation,The explanation preserves the contrast between abductive explanation and causal mechanism. The final conclusion follows only after weighing both.,grounded,consistent_abduction,"{""root"": ""Qualified Conclusion"", ""children"": [{""role"": ""Nucleus"", ""relation"": ""Cause""}, {""role"": ""Nucleus"", ""relation"": ""Condition""}]}",0.381,0.479,0.895,0.516,0.057,0.546,0.607,0.437
dcw_0346,legal complaint,The reasoning jumps from a weak correlation to breach of warranty. No competing explanation is discussed.,hallucinated,premature_closure,"{""root"": ""Unsupported Nucleus"", ""children"": [{""role"": ""Satellite"", ""relation"": ""Background""}, {""role"": ""Nucleus"", ""relation"": ""Result""}]}",0.865,0.299,0.276,0.947,0.727,0.017,0.166,0.708
dcw_0306,financial reasoning,"a superficial similarity suggests a possibility, so the explanation concludes expense misclassification without considering alternatives.",hallucinated,defeater_suppression,"{""root"": ""Overstated Conclusion"", ""children"": [{""role"": ""Satellite"", ""relation"": ""Cause""}, {""role"": ""Suppressed"", ""relation"": ""Defeater""}]}",0.658,0.246,0.131,0.798,0.872,0.198,0.055,0.982
dcw_0759,technical troubleshooting,The explanation preserves the contrast between Nginx routing error and SSL certificate problem. The final conclusion follows only after weighing both.,grounded,defeater_preservation,"{""root"": ""Evidence-Based Conclusion"", ""children"": [{""role"": ""Nucleus"", ""relation"": ""Evidence""}, {""role"": ""Satellite"", ""relation"": ""Defeater""}]}",0.118,0.859,0.702,0.081,0.132,0.661,0.664,0.015
dcw_0299,technical troubleshooting,"Nginx routing error is asserted as the central conclusion, while the available evidence is only an unverified assumption.",hallucinated,premature_closure,"{""root"": ""Premature Closure"", ""children"": [{""role"": ""Satellite"", ""relation"": ""Background""}, {""role"": ""Nucleus"", ""relation"": ""Result""}]}",0.794,0.221,0.198,0.795,0.662,0.258,0.304,0.819
dcw_0520,consumer dispute,"The claim is supported by observed symptoms. However, refund entitlement remains possible, so the conclusion is qualified.",grounded,evidence_integration,"{""root"": ""Evidence-Based Conclusion"", ""children"": [{""role"": ""Nucleus"", ""relation"": ""Evidence""}, {""role"": ""Satellite"", ""relation"": ""Justification""}]}",0.326,0.957,0.49,0.037,0.098,0.616,0.639,0.541
dcw_0662,legal complaint,"Because witness statements and observed symptoms both support merchant liability, and the alternative valid small-claims escalation is considered, the conclusion is cautiously accepted.",grounded,contrast_preservation,"{""root"": ""Qualified Conclusion"", ""children"": [{""role"": ""Nucleus"", ""relation"": ""Evidence""}, {""role"": ""Nucleus"", ""relation"": ""Contrast""}]}",0.393,0.895,0.726,0.13,0.405,0.546,0.83,0.416
dcw_0444,technical troubleshooting,"a vague symptom suggests a possibility, so the explanation concludes Nginx routing error without considering alternatives.",hallucinated,premature_closure,"{""root"": ""Unsupported Nucleus"", ""children"": [{""role"": ""Satellite"", ""relation"": ""Background""}, {""role"": ""Nucleus"", ""relation"": ""Result""}]}",0.885,0.246,0.211,0.592,0.628,0.132,0.27,0.73
dcw_0236,travel planning,"a vague symptom suggests a possibility, so the explanation concludes water logistics issue without considering alternatives.",hallucinated,contradiction_omission,"{""root"": ""Overstated Conclusion"", ""children"": [{""role"": ""Satellite"", ""relation"": ""Weak Evidence""}, {""role"": ""Omitted"", ""relation"": ""Contrast""}]}",0.895,0.27,0.088,0.713,0.726,0.054,0.231,0.551
dcw_0035,technical troubleshooting,a single ambiguous clue is mentioned. This clearly proves database schema mismatch. Therefore the conclusion is certain.,hallucinated,premature_closure,"{""root"": ""Premature Closure"", ""children"": [{""role"": ""Satellite"", ""relation"": ""Background""}, {""role"": ""Nucleus"", ""relation"": ""Result""}]}",0.559,0.243,0.35,0.707,0.825,0.43,0.228,0.889
dcw_0989,legal complaint,"witness statements suggests merchant liability, but a policy exception weakens a stronger conclusion. Therefore, the answer should remain tentative.",grounded,contrast_preservation,"{""root"": ""Stable Abductive Conclusion"", ""children"": [{""role"": ""Nucleus"", ""relation"": ""Evidence""}, {""role"": ""Nucleus"", ""relation"": ""Contrast""}]}",0.258,1.0,0.275,0.224,0.016,0.492,0.305,0.413
dcw_0039,consumer dispute,"service non-performance is asserted as the central conclusion, while the available evidence is only a superficial similarity.",hallucinated,contradiction_omission,"{""root"": ""Premature Closure"", ""children"": [{""role"": ""Satellite"", ""relation"": ""Weak Evidence""}, {""role"": ""Omitted"", ""relation"": ""Contrast""}]}",0.759,0.372,0.073,0.695,0.623,0.514,0.098,0.753
dcw_0130,medical diagnosis,a superficial similarity is mentioned. This clearly proves colon cancer. Therefore the conclusion is certain.,hallucinated,weak_evidence_amplification,"{""root"": ""Premature Closure"", ""children"": [{""role"": ""Satellite"", ""relation"": ""Weak Evidence""}, {""role"": ""Nucleus"", ""relation"": ""Result""}]}",0.564,0.184,0.269,0.895,0.989,0.355,0.147,0.997
dcw_0163,scientific explanation,"Although a known confounder could be relevant, it is ignored. Since an unverified assumption appears, measurement bias must be true.",hallucinated,contradiction_omission,"{""root"": ""Overstated Conclusion"", ""children"": [{""role"": ""Satellite"", ""relation"": ""Weak Evidence""}, {""role"": ""Omitted"", ""relation"": ""Contrast""}]}",0.625,0.13,0.023,0.929,0.81,0.476,0.333,0.768
dcw_0017,scientific explanation,"Although a known confounder could be relevant, it is ignored. Since a superficial similarity appears, abductive explanation must be true.",hallucinated,weak_evidence_amplification,"{""root"": ""Premature Closure"", ""children"": [{""role"": ""Satellite"", ""relation"": ""Weak Evidence""}, {""role"": ""Nucleus"", ""relation"": ""Result""}]}",0.728,0.302,0.105,0.692,0.876,0.04,0.16,0.999
