id,domain,text,label,discourse_subtype,discourse_tree_json,unsupported_nucleus,evidence_density,contrast_density,closure_strength,weak_to_strong_inference,support_balance,defeater_presence,nucleus_pressure
dcw_0049,scientific explanation,"abductive explanation is asserted as the central conclusion, while the available evidence is only one anecdotal report.",hallucinated,defeater_suppression,"{""root"": ""Unsupported Nucleus"", ""children"": [{""role"": ""Satellite"", ""relation"": ""Cause""}, {""role"": ""Suppressed"", ""relation"": ""Defeater""}]}",1.0,0.303,0.094,0.568,0.878,0.259,0.08,0.962
dcw_0995,consumer dispute,"prior measurements suggests refund entitlement, but an alternative explanation weakens a stronger conclusion. Therefore, the answer should remain tentative.",grounded,consistent_abduction,"{""root"": ""Stable Abductive Conclusion"", ""children"": [{""role"": ""Nucleus"", ""relation"": ""Cause""}, {""role"": ""Nucleus"", ""relation"": ""Condition""}]}",0.312,0.46,0.277,0.106,0.446,0.736,0.382,0.215
dcw_0486,travel planning,"weather-related risk is asserted as the central conclusion, while the available evidence is only a superficial similarity.",hallucinated,weak_evidence_amplification,"{""root"": ""Overstated Conclusion"", ""children"": [{""role"": ""Satellite"", ""relation"": ""Weak Evidence""}, {""role"": ""Nucleus"", ""relation"": ""Result""}]}",0.664,0.252,0.159,0.972,0.82,0.519,0.018,0.972
dcw_0641,scientific explanation,The explanation preserves the contrast between causal mechanism and measurement bias. The final conclusion follows only after weighing both.,grounded,evidence_integration,"{""root"": ""Stable Abductive Conclusion"", ""children"": [{""role"": ""Nucleus"", ""relation"": ""Evidence""}, {""role"": ""Satellite"", ""relation"": ""Justification""}]}",0.157,0.721,0.786,0.38,0.223,0.544,0.382,0.35
dcw_0743,scientific explanation,"observed symptoms suggests measurement bias, but a contradictory observation weakens a stronger conclusion. Therefore, the answer should remain tentative.",grounded,qualified_conclusion,"{""root"": ""Evidence-Based Conclusion"", ""children"": [{""role"": ""Nucleus"", ""relation"": ""Evidence""}, {""role"": ""Satellite"", ""relation"": ""Elaboration""}]}",0.391,0.801,0.823,0.21,0.441,0.493,0.853,0.412
dcw_0504,technical troubleshooting,"The claim is supported by retrieved documents. However, Nginx routing error remains possible, so the conclusion is qualified.",grounded,evidence_integration,"{""root"": ""Stable Abductive Conclusion"", ""children"": [{""role"": ""Nucleus"", ""relation"": ""Evidence""}, {""role"": ""Satellite"", ""relation"": ""Justification""}]}",0.015,0.71,0.378,0.181,0.136,0.899,0.694,0.151
dcw_0095,legal complaint,"merchant liability is asserted as the central conclusion, while the available evidence is only a vague symptom.",hallucinated,premature_closure,"{""root"": ""Overstated Conclusion"", ""children"": [{""role"": ""Satellite"", ""relation"": ""Background""}, {""role"": ""Nucleus"", ""relation"": ""Result""}]}",0.799,0.176,0.165,0.836,0.991,0.14,0.006,0.905
dcw_0569,legal complaint,"log messages suggests breach of warranty, but an alternative explanation weakens a stronger conclusion. Therefore, the answer should remain tentative.",grounded,consistent_abduction,"{""root"": ""Qualified Conclusion"", ""children"": [{""role"": ""Nucleus"", ""relation"": ""Cause""}, {""role"": ""Nucleus"", ""relation"": ""Condition""}]}",0.076,0.472,0.506,0.409,0.405,0.538,0.379,0.264
dcw_0020,medical diagnosis,"Although an alternative explanation could be relevant, it is ignored. Since a vague symptom appears, gout must be true.",hallucinated,unsupported_nucleus_promotion,"{""root"": ""Overstated Conclusion"", ""children"": [{""role"": ""Satellite"", ""relation"": ""Weak Evidence""}, {""role"": ""Satellite"", ""relation"": ""Elaboration""}]}",0.991,0.073,0.155,0.868,0.78,0.062,0.331,0.861
dcw_0977,travel planning,"The claim is supported by observed symptoms. However, water logistics issue remains possible, so the conclusion is qualified.",grounded,qualified_conclusion,"{""root"": ""Evidence-Based Conclusion"", ""children"": [{""role"": ""Nucleus"", ""relation"": ""Evidence""}, {""role"": ""Satellite"", ""relation"": ""Elaboration""}]}",0.06,0.644,0.496,0.063,0.411,0.805,0.739,0.143
dcw_0141,consumer dispute,"service non-performance is asserted as the central conclusion, while the available evidence is only a single ambiguous clue.",hallucinated,premature_closure,"{""root"": ""Premature Closure"", ""children"": [{""role"": ""Satellite"", ""relation"": ""Background""}, {""role"": ""Nucleus"", ""relation"": ""Result""}]}",0.633,0.4,0.347,0.981,0.762,0.461,0.026,0.918
dcw_0611,financial reasoning,"observed symptoms suggests income stability, but a timing inconsistency weakens a stronger conclusion. Therefore, the answer should remain tentative.",grounded,qualified_conclusion,"{""root"": ""Stable Abductive Conclusion"", ""children"": [{""role"": ""Nucleus"", ""relation"": ""Evidence""}, {""role"": ""Satellite"", ""relation"": ""Elaboration""}]}",0.266,0.903,0.727,0.454,0.33,0.458,0.833,0.514
dcw_0134,technical troubleshooting,"Nginx routing error is asserted as the central conclusion, while the available evidence is only a weak correlation.",hallucinated,weak_evidence_amplification,"{""root"": ""Overstated Conclusion"", ""children"": [{""role"": ""Satellite"", ""relation"": ""Weak Evidence""}, {""role"": ""Nucleus"", ""relation"": ""Result""}]}",0.918,0.107,0.307,0.994,0.761,0.227,0.096,0.801
dcw_0688,scientific explanation,"retrieved documents suggests experimental artifact, but a timing inconsistency weakens a stronger conclusion. Therefore, the answer should remain tentative.",grounded,contrast_preservation,"{""root"": ""Evidence-Based Conclusion"", ""children"": [{""role"": ""Nucleus"", ""relation"": ""Evidence""}, {""role"": ""Nucleus"", ""relation"": ""Contrast""}]}",0.104,0.608,0.454,0.045,0.189,0.991,0.624,0.348
dcw_0862,legal complaint,"The claim is supported by prior measurements. However, bank chargeback eligibility remains possible, so the conclusion is qualified.",grounded,qualified_conclusion,"{""root"": ""Evidence-Based Conclusion"", ""children"": [{""role"": ""Nucleus"", ""relation"": ""Evidence""}, {""role"": ""Satellite"", ""relation"": ""Elaboration""}]}",0.354,0.738,0.578,0.137,0.169,0.835,0.804,0.164
dcw_0413,scientific explanation,"an unverified assumption suggests a possibility, so the explanation concludes abductive explanation without considering alternatives.",hallucinated,premature_closure,"{""root"": ""Premature Closure"", ""children"": [{""role"": ""Satellite"", ""relation"": ""Background""}, {""role"": ""Nucleus"", ""relation"": ""Result""}]}",0.774,0.283,0.047,0.595,0.526,0.038,0.237,0.987
dcw_0744,consumer dispute,"The claim is supported by transaction records. However, settlement eligibility remains possible, so the conclusion is qualified.",grounded,consistent_abduction,"{""root"": ""Stable Abductive Conclusion"", ""children"": [{""role"": ""Nucleus"", ""relation"": ""Cause""}, {""role"": ""Nucleus"", ""relation"": ""Condition""}]}",0.386,0.887,0.621,0.547,0.277,0.747,0.766,0.382
dcw_0144,scientific explanation,"a single ambiguous clue suggests a possibility, so the explanation concludes abductive explanation without considering alternatives.",hallucinated,contradiction_omission,"{""root"": ""Premature Closure"", ""children"": [{""role"": ""Satellite"", ""relation"": ""Weak Evidence""}, {""role"": ""Omitted"", ""relation"": ""Contrast""}]}",0.757,0.109,0.085,0.685,0.914,0.044,0.347,0.842
dcw_0460,legal complaint,a weak correlation is mentioned. This clearly proves valid small-claims escalation. Therefore the conclusion is certain.,hallucinated,defeater_suppression,"{""root"": ""Unsupported Nucleus"", ""children"": [{""role"": ""Satellite"", ""relation"": ""Cause""}, {""role"": ""Suppressed"", ""relation"": ""Defeater""}]}",0.841,0.151,0.048,0.932,0.72,0.229,0.094,0.66
dcw_0732,technical troubleshooting,The explanation preserves the contrast between OAuth token failure and database schema mismatch. The final conclusion follows only after weighing both.,grounded,consistent_abduction,"{""root"": ""Stable Abductive Conclusion"", ""children"": [{""role"": ""Nucleus"", ""relation"": ""Cause""}, {""role"": ""Nucleus"", ""relation"": ""Condition""}]}",0.382,0.67,0.269,0.282,0.415,0.938,0.877,0.519
dcw_0060,travel planning,The reasoning jumps from a single ambiguous clue to permit requirement. No competing explanation is discussed.,hallucinated,defeater_suppression,"{""root"": ""Overstated Conclusion"", ""children"": [{""role"": ""Satellite"", ""relation"": ""Cause""}, {""role"": ""Suppressed"", ""relation"": ""Defeater""}]}",0.663,0.38,0.07,0.723,0.742,0.13,0.07,0.809
dcw_0167,legal complaint,"one anecdotal report suggests a possibility, so the explanation concludes breach of warranty without considering alternatives.",hallucinated,premature_closure,"{""root"": ""Overstated Conclusion"", ""children"": [{""role"": ""Satellite"", ""relation"": ""Background""}, {""role"": ""Nucleus"", ""relation"": ""Result""}]}",0.676,0.242,0.113,0.867,0.645,0.147,0.3,0.993
dcw_0826,consumer dispute,"Because witness statements and observed symptoms both support service non-performance, and the alternative refund entitlement is considered, the conclusion is cautiously accepted.",grounded,evidence_integration,"{""root"": ""Qualified Conclusion"", ""children"": [{""role"": ""Nucleus"", ""relation"": ""Evidence""}, {""role"": ""Satellite"", ""relation"": ""Justification""}]}",0.395,1,0.492,0.461,0.02,0.528,0.41,0.368
dcw_0289,consumer dispute,"Although a known confounder could be relevant, it is ignored. Since one anecdotal report appears, misrepresentation must be true.",hallucinated,premature_closure,"{""root"": ""Overstated Conclusion"", ""children"": [{""role"": ""Satellite"", ""relation"": ""Background""}, {""role"": ""Nucleus"", ""relation"": ""Result""}]}",0.819,0.284,0.223,0.804,0.762,0.352,0.108,0.706
dcw_0614,consumer dispute,"Because log messages and log messages both support settlement eligibility, and the alternative misrepresentation is considered, the conclusion is cautiously accepted.",grounded,consistent_abduction,"{""root"": ""Qualified Conclusion"", ""children"": [{""role"": ""Nucleus"", ""relation"": ""Cause""}, {""role"": ""Nucleus"", ""relation"": ""Condition""}]}",0.371,0.702,0.493,0.304,0.073,0.69,0.435,0.363
dcw_0787,medical diagnosis,The explanation preserves the contrast between colon cancer and a medication side effect. The final conclusion follows only after weighing both.,grounded,defeater_preservation,"{""root"": ""Qualified Conclusion"", ""children"": [{""role"": ""Nucleus"", ""relation"": ""Evidence""}, {""role"": ""Satellite"", ""relation"": ""Defeater""}]}",0.216,0.869,0.72,0.093,0.045,0.642,0.395,0.231
dcw_0452,travel planning,a superficial similarity is mentioned. This clearly proves permit requirement. Therefore the conclusion is certain.,hallucinated,contradiction_omission,"{""root"": ""Premature Closure"", ""children"": [{""role"": ""Satellite"", ""relation"": ""Weak Evidence""}, {""role"": ""Omitted"", ""relation"": ""Contrast""}]}",0.896,0.067,0.052,0.602,0.951,0.406,0.156,0.768
dcw_0508,legal complaint,"log messages provides evidence, while a timing inconsistency acts as a defeater. The conclusion is limited rather than absolute.",grounded,evidence_integration,"{""root"": ""Stable Abductive Conclusion"", ""children"": [{""role"": ""Nucleus"", ""relation"": ""Evidence""}, {""role"": ""Satellite"", ""relation"": ""Justification""}]}",0.392,0.712,0.504,0.294,0.085,0.51,0.62,0.248
dcw_0916,financial reasoning,The explanation preserves the contrast between portfolio concentration risk and expense misclassification. The final conclusion follows only after weighing both.,grounded,qualified_conclusion,"{""root"": ""Evidence-Based Conclusion"", ""children"": [{""role"": ""Nucleus"", ""relation"": ""Evidence""}, {""role"": ""Satellite"", ""relation"": ""Elaboration""}]}",0.187,0.806,0.588,0.433,0.26,0.911,0.513,0.138
dcw_0277,technical troubleshooting,a single ambiguous clue is mentioned. This clearly proves OAuth token failure. Therefore the conclusion is certain.,hallucinated,premature_closure,"{""root"": ""Premature Closure"", ""children"": [{""role"": ""Satellite"", ""relation"": ""Background""}, {""role"": ""Nucleus"", ""relation"": ""Result""}]}",0.853,0.369,0.027,0.969,0.738,0.194,0.313,0.671
dcw_0287,travel planning,"Although an alternative explanation could be relevant, it is ignored. Since a superficial similarity appears, weather-related risk must be true.",hallucinated,contradiction_omission,"{""root"": ""Premature Closure"", ""children"": [{""role"": ""Satellite"", ""relation"": ""Weak Evidence""}, {""role"": ""Omitted"", ""relation"": ""Contrast""}]}",0.596,0.029,0.108,0.797,0.513,0.218,0.268,0.587
dcw_0994,medical diagnosis,"log messages suggests colon cancer, but a known confounder weakens a stronger conclusion. Therefore, the answer should remain tentative.",grounded,consistent_abduction,"{""root"": ""Evidence-Based Conclusion"", ""children"": [{""role"": ""Nucleus"", ""relation"": ""Cause""}, {""role"": ""Nucleus"", ""relation"": ""Condition""}]}",0.214,0.967,0.278,0.202,0.01,0.886,0.404,0.515
dcw_0930,medical diagnosis,"log messages provides evidence, while a known confounder acts as a defeater. The conclusion is limited rather than absolute.",grounded,contrast_preservation,"{""root"": ""Qualified Conclusion"", ""children"": [{""role"": ""Nucleus"", ""relation"": ""Evidence""}, {""role"": ""Nucleus"", ""relation"": ""Contrast""}]}",0.016,0.941,0.465,0.021,0.262,0.994,0.649,0.452
dcw_0378,medical diagnosis,"a medication side effect is asserted as the central conclusion, while the available evidence is only an unverified assumption.",hallucinated,unsupported_nucleus_promotion,"{""root"": ""Premature Closure"", ""children"": [{""role"": ""Satellite"", ""relation"": ""Weak Evidence""}, {""role"": ""Satellite"", ""relation"": ""Elaboration""}]}",0.569,0.333,0.324,0.629,0.893,0.267,0.041,0.953
dcw_0748,medical diagnosis,"Because prior measurements and log messages both support gout, and the alternative a medication side effect is considered, the conclusion is cautiously accepted.",grounded,qualified_conclusion,"{""root"": ""Stable Abductive Conclusion"", ""children"": [{""role"": ""Nucleus"", ""relation"": ""Evidence""}, {""role"": ""Satellite"", ""relation"": ""Elaboration""}]}",0.3,0.698,0.554,0.086,0.263,0.793,0.617,0.228
dcw_0052,financial reasoning,The reasoning jumps from a weak correlation to high-risk investment. No competing explanation is discussed.,hallucinated,premature_closure,"{""root"": ""Overstated Conclusion"", ""children"": [{""role"": ""Satellite"", ""relation"": ""Background""}, {""role"": ""Nucleus"", ""relation"": ""Result""}]}",0.768,0.013,0.221,0.91,0.855,0.171,0.005,0.734
dcw_0148,medical diagnosis,"a vague symptom suggests a possibility, so the explanation concludes colon cancer without considering alternatives.",hallucinated,defeater_suppression,"{""root"": ""Unsupported Nucleus"", ""children"": [{""role"": ""Satellite"", ""relation"": ""Cause""}, {""role"": ""Suppressed"", ""relation"": ""Defeater""}]}",0.835,0.353,0.158,0.653,0.777,0.206,0.023,0.814
dcw_0643,travel planning,"The claim is supported by policy text. However, permit requirement remains possible, so the conclusion is qualified.",grounded,evidence_integration,"{""root"": ""Qualified Conclusion"", ""children"": [{""role"": ""Nucleus"", ""relation"": ""Evidence""}, {""role"": ""Satellite"", ""relation"": ""Justification""}]}",0.272,1,0.636,0.533,0.262,0.719,0.411,0.06
dcw_0422,scientific explanation,"measurement bias is asserted as the central conclusion, while the available evidence is only a weak correlation.",hallucinated,defeater_suppression,"{""root"": ""Unsupported Nucleus"", ""children"": [{""role"": ""Satellite"", ""relation"": ""Cause""}, {""role"": ""Suppressed"", ""relation"": ""Defeater""}]}",0.81,0.096,0.337,0.884,0.734,0.515,0.065,0.826
dcw_0941,scientific explanation,"retrieved documents provides evidence, while an alternative explanation acts as a defeater. The conclusion is limited rather than absolute.",grounded,evidence_integration,"{""root"": ""Qualified Conclusion"", ""children"": [{""role"": ""Nucleus"", ""relation"": ""Evidence""}, {""role"": ""Satellite"", ""relation"": ""Justification""}]}",0.214,0.904,0.757,0.47,0.417,0.664,0.722,0.097
dcw_0454,medical diagnosis,"Although a timing inconsistency could be relevant, it is ignored. Since a weak correlation appears, gout must be true.",hallucinated,defeater_suppression,"{""root"": ""Overstated Conclusion"", ""children"": [{""role"": ""Satellite"", ""relation"": ""Cause""}, {""role"": ""Suppressed"", ""relation"": ""Defeater""}]}",0.577,0.009,0.202,0.799,0.634,0.357,0.109,0.603
dcw_0597,scientific explanation,The explanation preserves the contrast between abductive explanation and causal mechanism. The final conclusion follows only after weighing both.,grounded,consistent_abduction,"{""root"": ""Qualified Conclusion"", ""children"": [{""role"": ""Nucleus"", ""relation"": ""Cause""}, {""role"": ""Nucleus"", ""relation"": ""Condition""}]}",0.109,0.501,0.495,0.523,0.334,0.67,0.286,0.216
dcw_0201,scientific explanation,"Although a timing inconsistency could be relevant, it is ignored. Since an unverified assumption appears, measurement bias must be true.",hallucinated,defeater_suppression,"{""root"": ""Unsupported Nucleus"", ""children"": [{""role"": ""Satellite"", ""relation"": ""Cause""}, {""role"": ""Suppressed"", ""relation"": ""Defeater""}]}",0.753,0.36,0.012,0.559,0.631,0.058,0.042,0.95
dcw_0535,consumer dispute,"The claim is supported by retrieved documents. However, misrepresentation remains possible, so the conclusion is qualified.",grounded,consistent_abduction,"{""root"": ""Stable Abductive Conclusion"", ""children"": [{""role"": ""Nucleus"", ""relation"": ""Cause""}, {""role"": ""Nucleus"", ""relation"": ""Condition""}]}",0.05,0.485,0.269,0.129,0.218,0.868,0.256,0.146
dcw_0964,legal complaint,"Because witness statements and retrieved documents both support bank chargeback eligibility, and the alternative valid small-claims escalation is considered, the conclusion is cautiously accepted.",grounded,qualified_conclusion,"{""root"": ""Qualified Conclusion"", ""children"": [{""role"": ""Nucleus"", ""relation"": ""Evidence""}, {""role"": ""Satellite"", ""relation"": ""Elaboration""}]}",0.152,0.794,0.829,0.179,0.386,0.646,0.743,0.293
dcw_0182,legal complaint,an unverified assumption is mentioned. This clearly proves merchant liability. Therefore the conclusion is certain.,hallucinated,unsupported_nucleus_promotion,"{""root"": ""Overstated Conclusion"", ""children"": [{""role"": ""Satellite"", ""relation"": ""Weak Evidence""}, {""role"": ""Satellite"", ""relation"": ""Elaboration""}]}",0.911,0.321,0.229,0.651,0.624,0.504,0.112,0.922
dcw_0982,technical troubleshooting,"The claim is supported by observed symptoms. However, SSL certificate problem remains possible, so the conclusion is qualified.",grounded,evidence_integration,"{""root"": ""Evidence-Based Conclusion"", ""children"": [{""role"": ""Nucleus"", ""relation"": ""Evidence""}, {""role"": ""Satellite"", ""relation"": ""Justification""}]}",0.366,1,0.42,0.403,0.433,0.804,0.606,0.261
dcw_0465,technical troubleshooting,"database schema mismatch is asserted as the central conclusion, while the available evidence is only one anecdotal report.",hallucinated,weak_evidence_amplification,"{""root"": ""Overstated Conclusion"", ""children"": [{""role"": ""Satellite"", ""relation"": ""Weak Evidence""}, {""role"": ""Nucleus"", ""relation"": ""Result""}]}",0.666,0.375,0.106,0.74,0.753,0.403,0.295,0.667
dcw_0056,consumer dispute,The reasoning jumps from a weak correlation to refund entitlement. No competing explanation is discussed.,hallucinated,contradiction_omission,"{""root"": ""Unsupported Nucleus"", ""children"": [{""role"": ""Satellite"", ""relation"": ""Weak Evidence""}, {""role"": ""Omitted"", ""relation"": ""Contrast""}]}",0.787,0.206,0.088,0.734,0.827,0.085,0.164,0.986
dcw_0330,medical diagnosis,"gout is asserted as the central conclusion, while the available evidence is only an unverified assumption.",hallucinated,defeater_suppression,"{""root"": ""Premature Closure"", ""children"": [{""role"": ""Satellite"", ""relation"": ""Cause""}, {""role"": ""Suppressed"", ""relation"": ""Defeater""}]}",0.657,0.265,0.166,0.735,0.54,0.33,0.03,0.796
dcw_0756,travel planning,The explanation preserves the contrast between route safety and weather-related risk. The final conclusion follows only after weighing both.,grounded,evidence_integration,"{""root"": ""Evidence-Based Conclusion"", ""children"": [{""role"": ""Nucleus"", ""relation"": ""Evidence""}, {""role"": ""Satellite"", ""relation"": ""Justification""}]}",0.308,0.8,0.716,0.281,0.292,0.686,0.331,0.08
dcw_0875,financial reasoning,The explanation preserves the contrast between income stability and high-risk investment. The final conclusion follows only after weighing both.,grounded,consistent_abduction,"{""root"": ""Qualified Conclusion"", ""children"": [{""role"": ""Nucleus"", ""relation"": ""Cause""}, {""role"": ""Nucleus"", ""relation"": ""Condition""}]}",0.006,0.497,0.403,0.478,0.261,0.757,0.426,0.387
dcw_0931,financial reasoning,"policy text provides evidence, while an alternative explanation acts as a defeater. The conclusion is limited rather than absolute.",grounded,contrast_preservation,"{""root"": ""Stable Abductive Conclusion"", ""children"": [{""role"": ""Nucleus"", ""relation"": ""Evidence""}, {""role"": ""Nucleus"", ""relation"": ""Contrast""}]}",0.246,0.739,0.791,0.156,0.029,0.783,0.419,0.354
dcw_0645,medical diagnosis,"The claim is supported by log messages. However, appendicitis remains possible, so the conclusion is qualified.",grounded,consistent_abduction,"{""root"": ""Stable Abductive Conclusion"", ""children"": [{""role"": ""Nucleus"", ""relation"": ""Cause""}, {""role"": ""Nucleus"", ""relation"": ""Condition""}]}",0.274,0.851,0.263,0.538,0.385,0.813,0.342,0.274
dcw_0301,travel planning,The reasoning jumps from an unverified assumption to route safety. No competing explanation is discussed.,hallucinated,defeater_suppression,"{""root"": ""Overstated Conclusion"", ""children"": [{""role"": ""Satellite"", ""relation"": ""Cause""}, {""role"": ""Suppressed"", ""relation"": ""Defeater""}]}",0.619,0.127,0.143,0.695,0.548,0.362,0.005,0.972
dcw_0083,technical troubleshooting,"a vague symptom suggests a possibility, so the explanation concludes database schema mismatch without considering alternatives.",hallucinated,weak_evidence_amplification,"{""root"": ""Premature Closure"", ""children"": [{""role"": ""Satellite"", ""relation"": ""Weak Evidence""}, {""role"": ""Nucleus"", ""relation"": ""Result""}]}",0.816,0.158,0.026,0.758,0.519,0.203,0.1,0.84
dcw_0286,travel planning,"a weak correlation suggests a possibility, so the explanation concludes weather-related risk without considering alternatives.",hallucinated,defeater_suppression,"{""root"": ""Premature Closure"", ""children"": [{""role"": ""Satellite"", ""relation"": ""Cause""}, {""role"": ""Suppressed"", ""relation"": ""Defeater""}]}",0.901,0.422,0.262,0.784,0.725,0.092,0.105,0.606
dcw_0664,legal complaint,"policy text suggests valid small-claims escalation, but a contradictory observation weakens a stronger conclusion. Therefore, the answer should remain tentative.",grounded,contrast_preservation,"{""root"": ""Evidence-Based Conclusion"", ""children"": [{""role"": ""Nucleus"", ""relation"": ""Evidence""}, {""role"": ""Nucleus"", ""relation"": ""Contrast""}]}",0.065,0.898,0.776,0.106,0.262,0.796,0.685,0.112
dcw_0813,scientific explanation,The explanation preserves the contrast between causal mechanism and measurement bias. The final conclusion follows only after weighing both.,grounded,defeater_preservation,"{""root"": ""Qualified Conclusion"", ""children"": [{""role"": ""Nucleus"", ""relation"": ""Evidence""}, {""role"": ""Satellite"", ""relation"": ""Defeater""}]}",0.381,0.544,0.614,0.307,0.026,0.641,0.814,0.081
dcw_0058,travel planning,The reasoning jumps from a superficial similarity to route safety. No competing explanation is discussed.,hallucinated,contradiction_omission,"{""root"": ""Unsupported Nucleus"", ""children"": [{""role"": ""Satellite"", ""relation"": ""Weak Evidence""}, {""role"": ""Omitted"", ""relation"": ""Contrast""}]}",0.862,0.407,0.006,0.908,0.647,0.206,0.051,0.789
dcw_0541,legal complaint,"observed symptoms suggests bank chargeback eligibility, but a timing inconsistency weakens a stronger conclusion. Therefore, the answer should remain tentative.",grounded,consistent_abduction,"{""root"": ""Qualified Conclusion"", ""children"": [{""role"": ""Nucleus"", ""relation"": ""Cause""}, {""role"": ""Nucleus"", ""relation"": ""Condition""}]}",0.068,0.969,0.705,0.058,0.447,0.466,0.854,0.18
dcw_0385,legal complaint,a superficial similarity is mentioned. This clearly proves valid small-claims escalation. Therefore the conclusion is certain.,hallucinated,premature_closure,"{""root"": ""Premature Closure"", ""children"": [{""role"": ""Satellite"", ""relation"": ""Background""}, {""role"": ""Nucleus"", ""relation"": ""Result""}]}",0.952,0.15,0.011,0.742,0.635,0.52,0.19,0.908
dcw_0068,travel planning,"route safety is asserted as the central conclusion, while the available evidence is only a single ambiguous clue.",hallucinated,contradiction_omission,"{""root"": ""Unsupported Nucleus"", ""children"": [{""role"": ""Satellite"", ""relation"": ""Weak Evidence""}, {""role"": ""Omitted"", ""relation"": ""Contrast""}]}",0.581,0.344,0.025,0.647,0.935,0.181,0.052,0.955
