id,domain,text,label,discourse_subtype,discourse_tree_json,unsupported_nucleus,evidence_density,contrast_density,closure_strength,weak_to_strong_inference,support_balance,defeater_presence,nucleus_pressure
dcw_0395,scientific explanation,"experimental artifact is asserted as the central conclusion, while the available evidence is only a vague symptom.",hallucinated,premature_closure,"{""root"": ""Overstated Conclusion"", ""children"": [{""role"": ""Satellite"", ""relation"": ""Background""}, {""role"": ""Nucleus"", ""relation"": ""Result""}]}",0.638,0.237,0.273,0.895,0.598,0.046,0.297,0.855
dcw_0436,scientific explanation,The reasoning jumps from a superficial similarity to experimental artifact. No competing explanation is discussed.,hallucinated,contradiction_omission,"{""root"": ""Unsupported Nucleus"", ""children"": [{""role"": ""Satellite"", ""relation"": ""Weak Evidence""}, {""role"": ""Omitted"", ""relation"": ""Contrast""}]}",0.734,0.066,0.036,0.668,0.809,0.499,0.129,0.858
dcw_0178,consumer dispute,"Although a timing inconsistency could be relevant, it is ignored. Since a weak correlation appears, settlement eligibility must be true.",hallucinated,premature_closure,"{""root"": ""Premature Closure"", ""children"": [{""role"": ""Satellite"", ""relation"": ""Background""}, {""role"": ""Nucleus"", ""relation"": ""Result""}]}",0.588,0.036,0.322,0.988,0.578,0.18,0.205,0.893
dcw_0420,legal complaint,one anecdotal report is mentioned. This clearly proves valid small-claims escalation. Therefore the conclusion is certain.,hallucinated,defeater_suppression,"{""root"": ""Overstated Conclusion"", ""children"": [{""role"": ""Satellite"", ""relation"": ""Cause""}, {""role"": ""Suppressed"", ""relation"": ""Defeater""}]}",0.646,0.119,0.104,0.808,0.902,0.344,0.117,0.873
dcw_0985,technical troubleshooting,"transaction records suggests SSL certificate problem, but a contradictory observation weakens a stronger conclusion. Therefore, the answer should remain tentative.",grounded,consistent_abduction,"{""root"": ""Stable Abductive Conclusion"", ""children"": [{""role"": ""Nucleus"", ""relation"": ""Cause""}, {""role"": ""Nucleus"", ""relation"": ""Condition""}]}",0.315,0.847,0.49,0.299,0.084,0.555,0.813,0.401
dcw_0797,travel planning,"The claim is supported by transaction records. However, route safety remains possible, so the conclusion is qualified.",grounded,defeater_preservation,"{""root"": ""Stable Abductive Conclusion"", ""children"": [{""role"": ""Nucleus"", ""relation"": ""Evidence""}, {""role"": ""Satellite"", ""relation"": ""Defeater""}]}",0.056,0.715,0.354,0.535,0.439,0.988,0.504,0.088
dcw_0061,medical diagnosis,"gout is asserted as the central conclusion, while the available evidence is only a weak correlation.",hallucinated,defeater_suppression,"{""root"": ""Overstated Conclusion"", ""children"": [{""role"": ""Satellite"", ""relation"": ""Cause""}, {""role"": ""Suppressed"", ""relation"": ""Defeater""}]}",0.774,0.407,0.1,0.909,0.804,0.194,0.078,0.829
dcw_0156,scientific explanation,"measurement bias is asserted as the central conclusion, while the available evidence is only a single ambiguous clue.",hallucinated,weak_evidence_amplification,"{""root"": ""Overstated Conclusion"", ""children"": [{""role"": ""Satellite"", ""relation"": ""Weak Evidence""}, {""role"": ""Nucleus"", ""relation"": ""Result""}]}",0.961,0.049,0.087,0.849,0.583,0.337,0.197,0.84
dcw_0539,financial reasoning,"retrieved documents suggests high-risk investment, but a known confounder weakens a stronger conclusion. Therefore, the answer should remain tentative.",grounded,defeater_preservation,"{""root"": ""Evidence-Based Conclusion"", ""children"": [{""role"": ""Nucleus"", ""relation"": ""Evidence""}, {""role"": ""Satellite"", ""relation"": ""Defeater""}]}",0.194,0.857,0.766,0.192,0.423,0.968,0.559,0.362
dcw_0853,travel planning,"Because prior measurements and log messages both support route safety, and the alternative weather-related risk is considered, the conclusion is cautiously accepted.",grounded,defeater_preservation,"{""root"": ""Evidence-Based Conclusion"", ""children"": [{""role"": ""Nucleus"", ""relation"": ""Evidence""}, {""role"": ""Satellite"", ""relation"": ""Defeater""}]}",0.324,0.654,0.445,0.269,0.246,0.86,0.398,0.094
dcw_0739,technical troubleshooting,The explanation preserves the contrast between SSL certificate problem and database schema mismatch. The final conclusion follows only after weighing both.,grounded,evidence_integration,"{""root"": ""Evidence-Based Conclusion"", ""children"": [{""role"": ""Nucleus"", ""relation"": ""Evidence""}, {""role"": ""Satellite"", ""relation"": ""Justification""}]}",0.149,0.86,0.468,0.294,0.164,0.882,0.887,0.292
dcw_0369,technical troubleshooting,"a superficial similarity suggests a possibility, so the explanation concludes database schema mismatch without considering alternatives.",hallucinated,defeater_suppression,"{""root"": ""Overstated Conclusion"", ""children"": [{""role"": ""Satellite"", ""relation"": ""Cause""}, {""role"": ""Suppressed"", ""relation"": ""Defeater""}]}",0.934,0.153,0.294,0.892,0.645,0.112,0.068,0.985
dcw_0936,travel planning,"retrieved documents suggests weather-related risk, but missing evidence weakens a stronger conclusion. Therefore, the answer should remain tentative.",grounded,consistent_abduction,"{""root"": ""Stable Abductive Conclusion"", ""children"": [{""role"": ""Nucleus"", ""relation"": ""Cause""}, {""role"": ""Nucleus"", ""relation"": ""Condition""}]}",0.166,0.718,0.892,0.081,0.398,0.582,0.643,0.526
dcw_0342,medical diagnosis,"appendicitis is asserted as the central conclusion, while the available evidence is only a superficial similarity.",hallucinated,unsupported_nucleus_promotion,"{""root"": ""Premature Closure"", ""children"": [{""role"": ""Satellite"", ""relation"": ""Weak Evidence""}, {""role"": ""Satellite"", ""relation"": ""Elaboration""}]}",0.837,0.094,0.07,0.679,0.766,0.425,0.235,0.673
dcw_0217,travel planning,"weather-related risk is asserted as the central conclusion, while the available evidence is only a weak correlation.",hallucinated,defeater_suppression,"{""root"": ""Premature Closure"", ""children"": [{""role"": ""Satellite"", ""relation"": ""Cause""}, {""role"": ""Suppressed"", ""relation"": ""Defeater""}]}",0.847,0.306,0.252,0.845,0.999,0.143,0.051,0.725
dcw_0174,travel planning,"Although an alternative explanation could be relevant, it is ignored. Since a weak correlation appears, permit requirement must be true.",hallucinated,contradiction_omission,"{""root"": ""Premature Closure"", ""children"": [{""role"": ""Satellite"", ""relation"": ""Weak Evidence""}, {""role"": ""Omitted"", ""relation"": ""Contrast""}]}",0.708,0.096,0.092,0.964,0.808,0.243,0.076,0.953
dcw_0874,travel planning,"observed symptoms suggests permit requirement, but missing evidence weakens a stronger conclusion. Therefore, the answer should remain tentative.",grounded,consistent_abduction,"{""root"": ""Stable Abductive Conclusion"", ""children"": [{""role"": ""Nucleus"", ""relation"": ""Cause""}, {""role"": ""Nucleus"", ""relation"": ""Condition""}]}",0.297,0.655,0.432,0.359,0.134,0.469,0.328,0.078
dcw_0529,financial reasoning,"Because policy text and policy text both support expense misclassification, and the alternative portfolio concentration risk is considered, the conclusion is cautiously accepted.",grounded,evidence_integration,"{""root"": ""Stable Abductive Conclusion"", ""children"": [{""role"": ""Nucleus"", ""relation"": ""Evidence""}, {""role"": ""Satellite"", ""relation"": ""Justification""}]}",0.196,0.953,0.632,0.225,0.017,0.957,0.5,0.311
dcw_0262,scientific explanation,The reasoning jumps from an unverified assumption to causal mechanism. No competing explanation is discussed.,hallucinated,defeater_suppression,"{""root"": ""Premature Closure"", ""children"": [{""role"": ""Satellite"", ""relation"": ""Cause""}, {""role"": ""Suppressed"", ""relation"": ""Defeater""}]}",0.918,0.155,0.277,0.949,0.503,0.485,0.054,0.653
dcw_0410,consumer dispute,The reasoning jumps from an unverified assumption to misrepresentation. No competing explanation is discussed.,hallucinated,defeater_suppression,"{""root"": ""Premature Closure"", ""children"": [{""role"": ""Satellite"", ""relation"": ""Cause""}, {""role"": ""Suppressed"", ""relation"": ""Defeater""}]}",0.993,0.193,0.3,0.953,0.901,0.516,0.045,0.556
dcw_0633,medical diagnosis,"Because transaction records and observed symptoms both support colon cancer, and the alternative a viral infection is considered, the conclusion is cautiously accepted.",grounded,qualified_conclusion,"{""root"": ""Evidence-Based Conclusion"", ""children"": [{""role"": ""Nucleus"", ""relation"": ""Evidence""}, {""role"": ""Satellite"", ""relation"": ""Elaboration""}]}",0.29,0.574,0.307,0.398,0.366,0.899,0.599,0.003
dcw_0285,medical diagnosis,"Although a known confounder could be relevant, it is ignored. Since an unverified assumption appears, gout must be true.",hallucinated,premature_closure,"{""root"": ""Overstated Conclusion"", ""children"": [{""role"": ""Satellite"", ""relation"": ""Background""}, {""role"": ""Nucleus"", ""relation"": ""Result""}]}",0.913,0.152,0.221,0.807,0.924,0.039,0.057,0.653
dcw_0404,financial reasoning,a vague symptom is mentioned. This clearly proves high-risk investment. Therefore the conclusion is certain.,hallucinated,weak_evidence_amplification,"{""root"": ""Premature Closure"", ""children"": [{""role"": ""Satellite"", ""relation"": ""Weak Evidence""}, {""role"": ""Nucleus"", ""relation"": ""Result""}]}",0.707,0.311,0.049,0.749,0.994,0.288,0.34,0.627
dcw_0847,consumer dispute,"Because log messages and observed symptoms both support misrepresentation, and the alternative refund entitlement is considered, the conclusion is cautiously accepted.",grounded,contrast_preservation,"{""root"": ""Evidence-Based Conclusion"", ""children"": [{""role"": ""Nucleus"", ""relation"": ""Evidence""}, {""role"": ""Nucleus"", ""relation"": ""Contrast""}]}",0.358,0.463,0.334,0.419,0.109,0.547,0.292,0.315
dcw_0524,scientific explanation,"Because witness statements and retrieved documents both support measurement bias, and the alternative causal mechanism is considered, the conclusion is cautiously accepted.",grounded,evidence_integration,"{""root"": ""Stable Abductive Conclusion"", ""children"": [{""role"": ""Nucleus"", ""relation"": ""Evidence""}, {""role"": ""Satellite"", ""relation"": ""Justification""}]}",0.097,0.897,0.839,0.366,0.112,0.828,0.718,0.334
dcw_0227,medical diagnosis,"a medication side effect is asserted as the central conclusion, while the available evidence is only a vague symptom.",hallucinated,weak_evidence_amplification,"{""root"": ""Unsupported Nucleus"", ""children"": [{""role"": ""Satellite"", ""relation"": ""Weak Evidence""}, {""role"": ""Nucleus"", ""relation"": ""Result""}]}",0.9,0.374,0.341,0.711,0.705,0.088,0.192,0.96
dcw_0276,consumer dispute,The reasoning jumps from a single ambiguous clue to settlement eligibility. No competing explanation is discussed.,hallucinated,premature_closure,"{""root"": ""Overstated Conclusion"", ""children"": [{""role"": ""Satellite"", ""relation"": ""Background""}, {""role"": ""Nucleus"", ""relation"": ""Result""}]}",0.938,0.217,0.09,0.722,0.894,0.121,0.245,0.91
dcw_0231,travel planning,The reasoning jumps from a vague symptom to route safety. No competing explanation is discussed.,hallucinated,contradiction_omission,"{""root"": ""Overstated Conclusion"", ""children"": [{""role"": ""Satellite"", ""relation"": ""Weak Evidence""}, {""role"": ""Omitted"", ""relation"": ""Contrast""}]}",0.855,0.082,0.047,0.711,0.514,0.376,0.293,0.988
dcw_0213,technical troubleshooting,a weak correlation is mentioned. This clearly proves database schema mismatch. Therefore the conclusion is certain.,hallucinated,contradiction_omission,"{""root"": ""Overstated Conclusion"", ""children"": [{""role"": ""Satellite"", ""relation"": ""Weak Evidence""}, {""role"": ""Omitted"", ""relation"": ""Contrast""}]}",0.564,0.168,0.073,0.63,0.935,0.323,0.122,0.624
dcw_0260,financial reasoning,"Although a timing inconsistency could be relevant, it is ignored. Since one anecdotal report appears, income stability must be true.",hallucinated,contradiction_omission,"{""root"": ""Overstated Conclusion"", ""children"": [{""role"": ""Satellite"", ""relation"": ""Weak Evidence""}, {""role"": ""Omitted"", ""relation"": ""Contrast""}]}",0.879,0.423,0.005,0.893,0.616,0.145,0.082,0.851
dcw_0337,financial reasoning,The reasoning jumps from a single ambiguous clue to income stability. No competing explanation is discussed.,hallucinated,unsupported_nucleus_promotion,"{""root"": ""Unsupported Nucleus"", ""children"": [{""role"": ""Satellite"", ""relation"": ""Weak Evidence""}, {""role"": ""Satellite"", ""relation"": ""Elaboration""}]}",0.841,0.217,0.22,0.951,0.768,0.184,0.274,0.736
dcw_0619,consumer dispute,"prior measurements suggests misrepresentation, but missing evidence weakens a stronger conclusion. Therefore, the answer should remain tentative.",grounded,contrast_preservation,"{""root"": ""Evidence-Based Conclusion"", ""children"": [{""role"": ""Nucleus"", ""relation"": ""Evidence""}, {""role"": ""Nucleus"", ""relation"": ""Contrast""}]}",0.047,0.767,0.505,0.419,0.412,0.911,0.353,0.177
dcw_0214,travel planning,"route safety is asserted as the central conclusion, while the available evidence is only an unverified assumption.",hallucinated,defeater_suppression,"{""root"": ""Unsupported Nucleus"", ""children"": [{""role"": ""Satellite"", ""relation"": ""Cause""}, {""role"": ""Suppressed"", ""relation"": ""Defeater""}]}",0.936,0.291,0.237,0.671,0.705,0.011,0.096,0.895
dcw_0220,consumer dispute,a weak correlation is mentioned. This clearly proves refund entitlement. Therefore the conclusion is certain.,hallucinated,unsupported_nucleus_promotion,"{""root"": ""Premature Closure"", ""children"": [{""role"": ""Satellite"", ""relation"": ""Weak Evidence""}, {""role"": ""Satellite"", ""relation"": ""Elaboration""}]}",0.95,0.225,0.304,0.722,0.649,0.03,0.299,0.612
dcw_0472,financial reasoning,The reasoning jumps from a weak correlation to income stability. No competing explanation is discussed.,hallucinated,premature_closure,"{""root"": ""Overstated Conclusion"", ""children"": [{""role"": ""Satellite"", ""relation"": ""Background""}, {""role"": ""Nucleus"", ""relation"": ""Result""}]}",0.752,0.39,0.114,0.91,0.832,0.225,0.081,0.728
dcw_0071,financial reasoning,The reasoning jumps from a vague symptom to portfolio concentration risk. No competing explanation is discussed.,hallucinated,premature_closure,"{""root"": ""Unsupported Nucleus"", ""children"": [{""role"": ""Satellite"", ""relation"": ""Background""}, {""role"": ""Nucleus"", ""relation"": ""Result""}]}",0.955,0.145,0.052,0.607,0.812,0.322,0.249,0.721
dcw_0844,technical troubleshooting,"Because observed symptoms and prior measurements both support SSL certificate problem, and the alternative OAuth token failure is considered, the conclusion is cautiously accepted.",grounded,evidence_integration,"{""root"": ""Stable Abductive Conclusion"", ""children"": [{""role"": ""Nucleus"", ""relation"": ""Evidence""}, {""role"": ""Satellite"", ""relation"": ""Justification""}]}",0.077,0.754,0.588,0.504,0.22,0.948,0.284,0.131
dcw_0206,scientific explanation,The reasoning jumps from a weak correlation to causal mechanism. No competing explanation is discussed.,hallucinated,contradiction_omission,"{""root"": ""Overstated Conclusion"", ""children"": [{""role"": ""Satellite"", ""relation"": ""Weak Evidence""}, {""role"": ""Omitted"", ""relation"": ""Contrast""}]}",0.947,0.214,0.01,0.956,0.857,0.276,0.315,0.91
dcw_0952,scientific explanation,"The claim is supported by prior measurements. However, experimental artifact remains possible, so the conclusion is qualified.",grounded,qualified_conclusion,"{""root"": ""Stable Abductive Conclusion"", ""children"": [{""role"": ""Nucleus"", ""relation"": ""Evidence""}, {""role"": ""Satellite"", ""relation"": ""Elaboration""}]}",0.368,0.681,0.678,0.148,0.023,0.488,0.867,0.324
dcw_0883,travel planning,"The claim is supported by retrieved documents. However, permit requirement remains possible, so the conclusion is qualified.",grounded,contrast_preservation,"{""root"": ""Evidence-Based Conclusion"", ""children"": [{""role"": ""Nucleus"", ""relation"": ""Evidence""}, {""role"": ""Nucleus"", ""relation"": ""Contrast""}]}",0.38,0.583,0.514,0.454,0.244,0.503,0.779,0.013
dcw_0735,travel planning,"retrieved documents suggests permit requirement, but missing evidence weakens a stronger conclusion. Therefore, the answer should remain tentative.",grounded,consistent_abduction,"{""root"": ""Stable Abductive Conclusion"", ""children"": [{""role"": ""Nucleus"", ""relation"": ""Cause""}, {""role"": ""Nucleus"", ""relation"": ""Condition""}]}",0.309,0.944,0.783,0.402,0.191,0.667,0.297,0.269
dcw_0264,medical diagnosis,"Although a timing inconsistency could be relevant, it is ignored. Since a weak correlation appears, a viral infection must be true.",hallucinated,premature_closure,"{""root"": ""Overstated Conclusion"", ""children"": [{""role"": ""Satellite"", ""relation"": ""Background""}, {""role"": ""Nucleus"", ""relation"": ""Result""}]}",0.781,0.401,0.051,0.625,0.961,0.284,0.142,0.986
dcw_0360,legal complaint,"one anecdotal report suggests a possibility, so the explanation concludes bank chargeback eligibility without considering alternatives.",hallucinated,premature_closure,"{""root"": ""Unsupported Nucleus"", ""children"": [{""role"": ""Satellite"", ""relation"": ""Background""}, {""role"": ""Nucleus"", ""relation"": ""Result""}]}",0.839,0.34,0.041,0.625,0.699,0.166,0.261,0.889
dcw_0612,financial reasoning,"observed symptoms provides evidence, while a policy exception acts as a defeater. The conclusion is limited rather than absolute.",grounded,consistent_abduction,"{""root"": ""Evidence-Based Conclusion"", ""children"": [{""role"": ""Nucleus"", ""relation"": ""Cause""}, {""role"": ""Nucleus"", ""relation"": ""Condition""}]}",0.001,0.698,0.791,0.069,0.202,0.983,0.313,0.12
dcw_0478,medical diagnosis,"a medication side effect is asserted as the central conclusion, while the available evidence is only a superficial similarity.",hallucinated,contradiction_omission,"{""root"": ""Overstated Conclusion"", ""children"": [{""role"": ""Satellite"", ""relation"": ""Weak Evidence""}, {""role"": ""Omitted"", ""relation"": ""Contrast""}]}",0.903,0.137,0.05,0.588,0.818,0.112,0.339,0.718
dcw_0140,travel planning,The reasoning jumps from one anecdotal report to water logistics issue. No competing explanation is discussed.,hallucinated,weak_evidence_amplification,"{""root"": ""Overstated Conclusion"", ""children"": [{""role"": ""Satellite"", ""relation"": ""Weak Evidence""}, {""role"": ""Nucleus"", ""relation"": ""Result""}]}",0.925,0.225,0.229,0.858,0.629,0.452,0.338,0.839
dcw_0534,legal complaint,The explanation preserves the contrast between breach of warranty and merchant liability. The final conclusion follows only after weighing both.,grounded,consistent_abduction,"{""root"": ""Qualified Conclusion"", ""children"": [{""role"": ""Nucleus"", ""relation"": ""Cause""}, {""role"": ""Nucleus"", ""relation"": ""Condition""}]}",0.201,0.511,0.619,0.117,0.09,0.862,0.776,0.106
dcw_0245,legal complaint,"Although a known confounder could be relevant, it is ignored. Since one anecdotal report appears, breach of warranty must be true.",hallucinated,weak_evidence_amplification,"{""root"": ""Unsupported Nucleus"", ""children"": [{""role"": ""Satellite"", ""relation"": ""Weak Evidence""}, {""role"": ""Nucleus"", ""relation"": ""Result""}]}",0.881,0.054,0.014,0.676,0.632,0.089,0.296,0.553
dcw_0544,scientific explanation,"The claim is supported by transaction records. However, measurement bias remains possible, so the conclusion is qualified.",grounded,evidence_integration,"{""root"": ""Stable Abductive Conclusion"", ""children"": [{""role"": ""Nucleus"", ""relation"": ""Evidence""}, {""role"": ""Satellite"", ""relation"": ""Justification""}]}",0.025,0.895,0.801,0.539,0.144,0.651,0.692,0.438
dcw_0837,legal complaint,"Because policy text and prior measurements both support valid small-claims escalation, and the alternative bank chargeback eligibility is considered, the conclusion is cautiously accepted.",grounded,qualified_conclusion,"{""root"": ""Qualified Conclusion"", ""children"": [{""role"": ""Nucleus"", ""relation"": ""Evidence""}, {""role"": ""Satellite"", ""relation"": ""Elaboration""}]}",0.157,0.709,0.603,0.249,0.407,0.976,0.816,0.227
dcw_0288,scientific explanation,"Although a contradictory observation could be relevant, it is ignored. Since an unverified assumption appears, experimental artifact must be true.",hallucinated,defeater_suppression,"{""root"": ""Overstated Conclusion"", ""children"": [{""role"": ""Satellite"", ""relation"": ""Cause""}, {""role"": ""Suppressed"", ""relation"": ""Defeater""}]}",0.678,0.282,0.046,0.927,0.514,0.365,0.105,0.696
dcw_0665,medical diagnosis,"Because retrieved documents and policy text both support a medication side effect, and the alternative colon cancer is considered, the conclusion is cautiously accepted.",grounded,contrast_preservation,"{""root"": ""Qualified Conclusion"", ""children"": [{""role"": ""Nucleus"", ""relation"": ""Evidence""}, {""role"": ""Nucleus"", ""relation"": ""Contrast""}]}",0.273,0.977,0.723,0.29,0.086,0.564,0.788,0.275
dcw_0363,scientific explanation,one anecdotal report is mentioned. This clearly proves abductive explanation. Therefore the conclusion is certain.,hallucinated,contradiction_omission,"{""root"": ""Overstated Conclusion"", ""children"": [{""role"": ""Satellite"", ""relation"": ""Weak Evidence""}, {""role"": ""Omitted"", ""relation"": ""Contrast""}]}",0.554,0.031,0.05,0.786,0.843,0.193,0.254,0.663
dcw_0893,legal complaint,The explanation preserves the contrast between breach of warranty and bank chargeback eligibility. The final conclusion follows only after weighing both.,grounded,evidence_integration,"{""root"": ""Qualified Conclusion"", ""children"": [{""role"": ""Nucleus"", ""relation"": ""Evidence""}, {""role"": ""Satellite"", ""relation"": ""Justification""}]}",0.149,0.881,0.258,0.289,0.12,0.742,0.447,0.446
dcw_0682,technical troubleshooting,"Because prior measurements and witness statements both support OAuth token failure, and the alternative SSL certificate problem is considered, the conclusion is cautiously accepted.",grounded,qualified_conclusion,"{""root"": ""Stable Abductive Conclusion"", ""children"": [{""role"": ""Nucleus"", ""relation"": ""Evidence""}, {""role"": ""Satellite"", ""relation"": ""Elaboration""}]}",0.006,0.915,0.802,0.297,0.02,0.579,0.321,0.279
dcw_0852,technical troubleshooting,"The claim is supported by observed symptoms. However, database schema mismatch remains possible, so the conclusion is qualified.",grounded,defeater_preservation,"{""root"": ""Evidence-Based Conclusion"", ""children"": [{""role"": ""Nucleus"", ""relation"": ""Evidence""}, {""role"": ""Satellite"", ""relation"": ""Defeater""}]}",0.302,0.687,0.688,0.494,0.201,0.987,0.688,0.175
dcw_0470,travel planning,a vague symptom is mentioned. This clearly proves permit requirement. Therefore the conclusion is certain.,hallucinated,unsupported_nucleus_promotion,"{""root"": ""Unsupported Nucleus"", ""children"": [{""role"": ""Satellite"", ""relation"": ""Weak Evidence""}, {""role"": ""Satellite"", ""relation"": ""Elaboration""}]}",0.716,0.13,0.183,0.603,0.652,0.206,0.103,0.563
dcw_0765,medical diagnosis,"retrieved documents suggests appendicitis, but a known confounder weakens a stronger conclusion. Therefore, the answer should remain tentative.",grounded,consistent_abduction,"{""root"": ""Stable Abductive Conclusion"", ""children"": [{""role"": ""Nucleus"", ""relation"": ""Cause""}, {""role"": ""Nucleus"", ""relation"": ""Condition""}]}",0.047,0.496,0.378,0.298,0.097,0.718,0.62,0.32
dcw_0623,medical diagnosis,The explanation preserves the contrast between gout and appendicitis. The final conclusion follows only after weighing both.,grounded,consistent_abduction,"{""root"": ""Stable Abductive Conclusion"", ""children"": [{""role"": ""Nucleus"", ""relation"": ""Cause""}, {""role"": ""Nucleus"", ""relation"": ""Condition""}]}",0.253,0.698,0.355,0.164,0.407,0.813,0.66,0.47
dcw_0019,technical troubleshooting,"OAuth token failure is asserted as the central conclusion, while the available evidence is only a vague symptom.",hallucinated,weak_evidence_amplification,"{""root"": ""Unsupported Nucleus"", ""children"": [{""role"": ""Satellite"", ""relation"": ""Weak Evidence""}, {""role"": ""Nucleus"", ""relation"": ""Result""}]}",0.673,0.272,0.251,0.642,0.817,0.145,0.171,0.957
dcw_0978,scientific explanation,"Because prior measurements and witness statements both support experimental artifact, and the alternative abductive explanation is considered, the conclusion is cautiously accepted.",grounded,evidence_integration,"{""root"": ""Stable Abductive Conclusion"", ""children"": [{""role"": ""Nucleus"", ""relation"": ""Evidence""}, {""role"": ""Satellite"", ""relation"": ""Justification""}]}",0.209,1,0.348,0.453,0.13,0.792,0.278,0.209
dcw_0948,financial reasoning,"observed symptoms provides evidence, while a timing inconsistency acts as a defeater. The conclusion is limited rather than absolute.",grounded,defeater_preservation,"{""root"": ""Qualified Conclusion"", ""children"": [{""role"": ""Nucleus"", ""relation"": ""Evidence""}, {""role"": ""Satellite"", ""relation"": ""Defeater""}]}",0.237,0.71,0.61,0.303,0.343,0.516,0.777,0.432
